{
  "schema_version": 1,
  "id": "standard:astm-e648",
  "title": "ASTM E648",
  "publisher": "ASTM International",
  "url": "https://www.astm.org/e0648-23.html",
  "edition": null,
  "effective_date": null,
  "rights": "reference-metadata-only",
  "access": "metadata-only",
  "coverage": "403 on attempted edition page; no fulltext or adopted-edition claim."
}
