{
  "schema_version": 1,
  "id": "standard:ul-723",
  "title": "UL 723",
  "publisher": "UL Standards & Engagement",
  "url": "https://www.shopulstandards.com/ProductDetail.aspx?UniqueKey=34224",
  "edition": "11",
  "effective_date": null,
  "rights": "reference-metadata-only",
  "access": "metadata-only",
  "coverage": "Publisher lists edition11, published2018-04-19, revision2025-06-23. This is not proof of edition adopted by NYC."
}
