{
  "schema_version": 1,
  "id": "standard:nfpa-253",
  "title": "NFPA 253",
  "publisher": "NFPA",
  "url": "https://www.nfpa.org/codes-and-standards/nfpa-253-standard-development/253",
  "edition": null,
  "effective_date": null,
  "rights": "reference-metadata-only",
  "access": "metadata-only",
  "coverage": "Official page returned zero extractable lines; adopted edition must come from code reference table, not latest publisher version."
}
